{
  "schema_version": "response-command/1.0",
  "command_id": "00000000-0000-4000-8000-000000000203",
  "detection_id": null,
  "incident_id": "inc-0001",
  "policy_version": "policy-2026.09.26",
  "action": "REQUIRE_REAUTH",
  "target_type": "SUBJECT",
  "target_key": {
    "key": "fx-subject-0002",
    "key_version": "fixture-v1"
  },
  "environment": "local-secure",
  "requested_at": "2026-09-26T10:06:10Z",
  "expires_at": "2026-09-26T10:21:10Z",
  "mode": "ENFORCE",
  "evidence_ref": "incident:inc-0001",
  "expected_state_version": 3
}
