{
  "schema_version": "response-command/1.0",
  "command_id": "00000000-0000-4000-8000-000000000204",
  "detection_id": "b25a35c61b191d3bf51157b07c99484de010033824b2dd2fd582b26d0a892730",
  "incident_id": null,
  "policy_version": "policy-2026.09.26",
  "action": "LOCK_ACCOUNT",
  "target_type": "SUBJECT",
  "target_key": {
    "key": "fx-subject-0002",
    "key_version": "fixture-v1"
  },
  "environment": "local-lab",
  "requested_at": "2026-09-26T10:06:10Z",
  "expires_at": "2026-09-26T10:21:10Z",
  "mode": "ENFORCE",
  "evidence_ref": "anomaly-detection:b25a35c61b191d3bf51157b07c99484de010033824b2dd2fd582b26d0a892730",
  "expected_state_version": 7
}
